iteration	branch	campaign_id	balanced_score	avg_rating	num_ratings	send_count	participation_rate	status	what_changed
1	ar-exp-6_9_26__2_18pm	156	2.6700	2.670	3	3	1.000	keep	baseline (fresh start): gentle universal nature/morning haiku, calm and warm tone, centered serif-italic formatting; subject is a soft curiosity invite. Establishes the reference score before any exploration.
2	ar-exp-6_9_26__2_18pm	157	0.0000	0.000	0	3	0.000	crash	big exploratory swing vs gentle baseline (iter1, 2.67): switched to relatable internet-age humor — the brief panic of losing Wi-Fi. Surprise + universal recognition for an online audience; playful curiosity subject matched to the joke. Varied SUBJECT + MAIN_CONTENT.
3	ar-exp-6_9_26__2_18pm	158	1.0000	1.000	3	3	1.000	discard	re-attempt exploration after iter2 produced no signal (crash). Kept the humor hypothesis but fresh angle: the universally relatable losing-battle with the morning alarm/snooze + coffee-as-hero punchline. Varied SUBJECT + MAIN_CONTENT vs best (iter1, 2.67).
4	ar-exp-6_9_26__2_18pm	159	3.0000	3.000	3	3	1.000	keep	derived from best (iter1 calm/wholesome vein, 2.67) since humor underperformed (iter3=1.0). Deepened the serene angle with a vivid sensory image — petrichor that 'smells like childhood'; gentle evocative SUBJECT to match. Varied SUBJECT + MAIN_CONTENT.
5	ar-exp-6_9_26__2_18pm	160	1.0000	1.000	3	3	1.000	discard	refined the new best (iter4 serene-sensory, 3.0). Same proven stillness/sensory family, fresh image: first snow hushing the city with a softly whimsical 'streetlights wear new hats' close — testing whether a touch of gentle wonder lifts the calm vein. Varied SUBJECT + MAIN_CONTENT.
6	ar-exp-6_9_26__2_18pm	161	4.0000	4.000	3	3	1.000	keep	derived from best (iter4, 3.0); dropped iter5's whimsical twist and returned to pure cozy stillness — lamplight, rain on glass, 'nowhere else to be' (warm, relieving, universal). Varied SUBJECT + MAIN_CONTENT.
7	ar-exp-6_9_26__2_18pm	162	5.0000	5.000	3	3	1.000	keep	refined the winner (iter6, 4.0) within its proven 'permission to rest / cozy comfort' theme. New sibling image adding a personal, embodied release — 'the day sets itself down... so do your shoulders'; SUBJECT leans into that felt relief. Varied SUBJECT + MAIN_CONTENT.
